text,date
"To avoid redundancy of similar questions in the comments section, we kindly ask /u/feetstreetseat to respond to this comment with the prompt you used to generate the output in this post, so that others may also try it out.

While you're here, we have a [public discord server](https://discord.gg/NuefU36EC2). ***We have a free Chatgpt bot, Bing chat bot and AI image generator bot.***

####[So why not join us?](https://discord.gg/r-chatgpt-1050422060352024636)

^(Ignore this comment if your post doesn't have a prompt.)


*I am a bot, and this action was performed automatically. Please [contact the moderators of this subreddit](/message/compose/?to=/r/ChatGPT) if you have any questions or concerns.*",2023-03-06 23:27:13
"GPTzero is not reliable. OpenAI recently released an official AI classifier to detect if text is AI written. Run your text through the official classifier and see the result. Only caveat is you need an OpenAI account, but you can get one for free by signing up with email. https://platform.openai.com/ai-text-classifier",2023-03-01 23:31:08
"Deny and escalate. If you have work previous to Chatgpt run it through to see if you get a false positive then use that as evidence in your favor. Use OpenAI's own words to your defense:

""“We really don’t recommend taking this tool in isolation because we know that it can be wrong and will be wrong at times – much like using AI for any kind of assessment purposes,"" Lama Ahmad, policy research director at OpenAI, told CNN.""",2023-03-01 21:49:49
"If it makes you feel any better, I was accused of copying a science paper from the internet in high school. It was basically the 2002 equivalent of using ChatGPT to write a paper today. In this case, it was solely because the paper was well written and “you sort of dress like a punk so this doesn’t seem in character.” I told him to ask me to write about anything, while he’s watching me, and I would consistently produce results of a comparable quality. I did. He felt stupid. We didn’t have to escalate. I don’t know if that’s helpful here, but it helped me back then. 

All the same, being accused of wrongdoing when you haven’t actually done anything wrong and having to “prove” yourself to such a person can be an absolutely awful feeling, and I hope it passes without much further incident. But yes. If you’re being downright accused of something you didn’t do no matter what is being said, bring it to higher ups. Escalate.

Edit: word",2023-03-01 23:16:45
you could show him the revision history to show you typed everything out,2023-03-01 22:56:01
"whatever you do, no matter what, do NOT just give in and say you cheated when you didn't. i made that mistake once because i was too unbothered to deal with anything, and regretted it ever since. if you did nothing wrong, deny it till the end.",2023-03-02 00:13:37
Escalate.,2023-03-01 22:01:42
According to Google Grammarly uses gpt3.,2023-03-01 23:29:50
Did you use AI?,2023-03-01 23:15:54
"Show your work, son.. 

https://preview.redd.it/2a8h9kwt19la1.png?width=515&format=png&auto=webp&v=enabled&s=40ca3ab57a03b7d77cef42d9f5645170159c585f",2023-03-01 22:59:20
"Well, you should ask chatGPT what to do!",2023-03-02 00:11:26
"Your teacher is going to learn very soon that AI detector tools are not reliable enough to detect whether one has used AI and they never will be! If you want to prevent this for next time, run it through GPTzero yourself and change the highlighted parts.",2023-03-01 23:21:01
Find something your teacher wrote and run it through the checker.,2023-03-01 23:25:12
If wrote it in Google docs you can show the revision history. I'm not sure if Microsoft Word has a similar feature.,2023-03-02 00:07:28
"GPTzero is not a reliable tool. It is not proof. 

Just say you 100% did not use AI (even if you did) and there is currently no actual proof possible to actually show you did.

Escalate above the teacher and demand proof and demand why any proof they provide is legitimate... Because none of these tools are accurate right now.

Deny, deny, deny. Escalate. Rope in your parents too if you have to.",2023-03-02 03:02:13
"Once got a F on a book report because a teacher said the book I wrote it on wasn't a real book.

I went to my locker and brought it to her and slammed it on her desk I was so pissed.",2023-03-02 03:11:27
Get GPT to write a strongly worded letter.,2023-03-01 23:45:10
"One of our kids lost out on a school Science Fair prize because they were judged to be using adult-level language, and the research involved was ""too well done for a kid without adult help"" —and so heavily marked down.

That was utterly untrue: we'd had nothing to do with the project subject, methods, or write-up. We only only gave pointers on the delivery of the verbal part of the presentation (speech, body language, and lecturing skills), once the project was complete and written up. Just a bloody clever kid, who was thoroughly demoralised by being disbelieved.

We didn't take any action over that one, as invigilation was external, and we figured it was also a(n unpleasant) life lesson. But any time there is a suggestion we do our kids' school work that could impact their grades, we'll go into bat on their behalf. 

Have you involved your parents?",2023-03-01 23:52:57
GPTzero is fucking useless. I just put a normal ass comment I wrote yesterday on reddit and it thinks it's AI written.,2023-03-02 01:52:39
"Idea: Has he written anything? Even phrases that are on tests or comments? Syllabi? If so, here’s what you can do…

Take things he wrote. Type them into a word doc. Then, run them through ChatGPT zero until you find a positive. Don’t show him.

Escalate it then to the next person up - principal or whatever. Now, ask for a meeting with both. Grab the passages he wrote and put them into the GPT zero thing. Show that his own writing is causing false positives. Then, ask for consideration on your own and mention that the school needs to consider how easy it is to mess with someone’s future over unproven tech. 

Although, if this doesn’t work, it might just be that Grammarly premium caused the issue. In that case, not much you can do, unless Grammarly is allowed, in which case, do the same thing to show them how it can cause a false positive.

This is probably happening to students other than you.",2023-03-01 23:31:32
"Bring it to the principal. This could not only affect your grade, but also, your academic reputation.",2023-03-02 01:52:10
"My sister ran into this same situation in her class, so she put her original words that the teacher failed back into chatGPT and asked it to rewrite it - and then after tweaking a bit and trying a few checks online that came back clean she resubmitted it and the teacher passed it.

 Its stupid, she was better off cheating from the start haha.",2023-03-02 03:29:27
"This kind of stuff grinds my gears. My grandpa was a gifted artist and could draw beautifully even at a young age. We didn’t find this out until he was quite old, because we never saw him draw anything. It turns out he stopped drawing because some asshole art teacher accused him of passing someone else’s work off as his own and literally tore up one of his assignments. So instead of fostering talent and encouraging creative growth, this asshole teacher just stamped it out and took a dump on it.

I had a similar instance where a professor called me out during a presentation. It was a 3D modeling and animation course and we were showing our work to the class. When my project came up he immediately said, “Oops! Someone cheated!” When actually, I had just spent a lot of time on it because I enjoyed the work and wanted it to look good.

If you suspect cheating, the burden of proof is on you because you’re the one making the accusation. I shouldn’t have to prove jack shit.",2023-03-02 01:10:42
"Your teacher clearly doesn't know much about the origins of GPTZero. It was created by a grad student at Princeton and even he acknowledges it's limited usefulness at this point. It may get better but there are some serious limitations and inaccuracies in identifying AI produced content. As a live demonstration, I put in a text the other day taken directly from ChatGPT and it told me (in front of an audience of hundreds) that the text was “likely written by a human.”  So much for AI detectors at the moment. 

As others have suggested here, find some older papers as evidence. Your teacher just doesn't understand much about how AI works. It's already having a hugely disruptive impact on education - both high school and at the university level. 

DM me if you want more info. Source: I do consulting work in XR and AI and currently doing workshops both in the U.S. and around the world on these issues. Good luck!",2023-03-02 03:16:38
Ask your teacher how they know that gptzero is accurate enough to accuse you of something as serious as cheating.,2023-03-02 03:47:49
"Find papers, articles, etc. written by your teacher.  Run them through GPTzero or similar tools.  If they say ""AI written"" then use that to demonstrate to your teacher the problem of false positives.",2023-03-01 23:31:57
"Tell him that if he knew how to grade papers instead of relying on an AI to do it, you wouldn't be having this problem.",2023-03-02 02:02:38
"have chatgpt write you a rebuttal.

show articles showing gptzero isn't accurate.",2023-03-02 00:58:49
Ask for an oral exam to confirm your understanding and command of the topic.,2023-03-02 02:23:04
"See, this is what I don't like about tools like Turnitin and GPTZero, or rather I should say I don't like the way they tend to be used by people who don't understand them. 

They \*always\* come with a ton of disclaimers. Basically that \*some\* detection of ""plagiarism"" or ""AI generated content"" or whatever they're supposed to detect is ""normal."" That they're imperfect/make mistakes. That their results should be taken with a large grain of salt and a good dose of nuance because they can't be coded to have ""common sense"" and might mark something as ""plagiarized"" because it's a quote or something the same student said in a previous paper. etc. 

They're fine and good when used holistically as a tool to determine whether someone \*might\* have cheated. But you always get the odd person here and there who's like ""oh, the software says you cheated so you must have."" Which isn't how they're intended to be used -- even the people who developed them would tell you so. 

&#x200B;

Oh, also I tend to write very formally in professional settings so I did a little experiment: 

I pulled up a few of my old papers from college and ran them through GPTZero. Out of four, one was ""entirely human written"", one was ""entirely AI generated"", and two were ""partially AI generated"", with about half the text highlighted. 

At the same time, I wasn't able to get it to misclassify \*any\* AI-generated texts as human-written, despite several different approaches (ie trying to get ChatGPT to play a role, which sometimes makes it speak more naturally, explaining perplexity and burstiness to ChatGPT and asking it to write with a high degree of both, running some of my old AI-generated paragraphs through it that passed other AI-detection platforms with flying colors, etc.) So I honestly think it's a bit biased/""trigger happy"" in the direction of classifying things as AI-generated. Just my two cents.",2023-03-02 03:47:29
" At this point, if the teacher is not willing to come to an agreement, as a former teacher, my advice is to follow the legal processes available in your country. To begin with, demand that the teacher provide you with detailed written documentation of the sanction, with objective causes related to it. Once you have that documentation (if they refuse to provide it in any country, it would be sufficient reason for the educational inspection to reject the teacher's sanction), submit it to inspection and, if necessary, put it in the hands of a lawyer to process. The fact that you supposedly used ChatGPT detected with an artificial intelligence tool is laughable, and a proof that the teacher is a fool and that traditional education, which is increasingly losing prestige, is in a suicidal delirium.",2023-03-02 04:49:08
Use Quillbot to make it impossible for gpt to say that your work is made with AI,2023-03-01 22:19:44
"Before escalating:

* read about GPTzero false positive rates. 
* Watch the 3B1B video: The medical test paradox, and redesigning Bayes' rule 

This will help you understand how and why a significant number of flags from GPTzero will not be AI-written.",2023-03-02 01:04:24
"Don’t give in. ChatGPT and GPTZero are unreliable and are not perfect. Prove them wrong. Threaten and escalate and take legal action and say that you take this accusations seriously. And say his job is on the line if he doesn’t back off and doesn’t give you an A+ for your course’s final mark, as consolation for what he’s accused you of.",2023-03-02 01:38:06
It's ironic how using AI to detect cheating is so much more unethical than using it to cheat.,2023-03-02 02:52:07
"What you should do is find someone who doesn't work for one of these companies, but is in the field, e.g. a university professor, email them, and kindly ask them to help you communicate to your teacher that these tools are far from reliable enough to detect cheating, period.  They just aren't.  It's astounding how these companies have no compunction about ruining people's lives just to sell snake oil.  Oh, wait, it isn't shocking at all.  In The US, we're supposed to be worshipping people who run their businesses like that.  


I suspect it wouldn't be too hard for you to find someone who'd even go so far as to contact your teacher themselves.  It is unconscionable that the burden of proof is somehow on YOU.  It's your teacher's job to adapt to the changing world, not the other way around, and your grade/future should not be on the line simply because your teacher is flailing.  Your teacher has to deal with the fact that, from now on, there WILL be AI-written essays.  Period.  Moreover, if someone wanted to cheat using ChatGPT, unless they were pathetically lazy, they'd rewrite all/most of it anyway.  I must confess, I am not POSITIVE about this, but I am \*extremely\* skeptical of claims that any software exists that is suitable for accusing a student of cheating without supporting evidence.  Of course the developers of the software will claim that!",2023-03-02 04:26:03
[deleted],2023-03-02 08:36:32
"1. show him articles about how GPTzero can be wrong?

2. Talk with the principal?",2023-03-02 03:07:21
Show him papers you’ve written before the ChatGPT era. Test for yourself if they get flagged as AI.,2023-03-02 03:10:48
Plot twist: OP is AI,2023-03-02 03:30:40
"i wonder if my old english teacher from 2 decades ago is teaching your class. something similar happened to me in sophomore year highschool english. this was way before chatGPT or even prevalent use of online plagiarism checkers though.

had to write a paper/essay that I worked really hard on. when i got the grade it was a C to my surprise. i was used to getting good grades. 

i asked my teacher about it and she said ""no one your age writes like that"" so you likely plagiarized it. i wasn't happy about it at all because i knew some of my classmates that actually plagiarized yet got As and Bs. the grade she gave me felt personal or as if she had a vendetta against seeing me succeed for some reason. i cant put my finger on it but it just didnt feel right.

There wasn't a whole lot i could do either. I don't remember if i complained to any higher ups but the end result was i wound up testing into honors/AP english after that.",2023-03-02 03:34:31
"Probably the first thing I ever put time into writing was flagged as plagiarism in college. I argued Mark Twain was pro-slavery in an essay on Huckleberry Finn. I got a B-, I doubt this was resolved before I dropped out entirely. Good luck with all that.",2023-03-02 04:30:57
">I’ve told my teacher everything and he still doesn’t believe me. What should I do in this situation?!!

1. Request your parents/guardians that they get involved.


2. Write an official, and  professional email to your teacher, cc the principal and your academic counselor, you can CC this to others who you feel may be useful such as your parents, explain that you're concerned about this paper, and accusation. 

Remind them that you're a high achieving student, include your GPA, and high marks, and extracurricular activities. Insist that the program used is created by a group biased against Ai, while it uses ai to detect ai, and that all current Ai programs are inaccurate, say that it's common knowledge. Say that it's a poor policy to use such inaccurate tools as they're well known for calling human work, ""ai work."" Admit that you do use grammarly premium to help catch issues that you dislike in your prose, that all other writing software can do pretty much the same including Word, and that GPTZero may simply be picking up corrections you would make anyway, without the grammarly.

 If this is usual behavior from the teacher include behavior that relates, and say you believe the teacher is compromised by some kind of bias, suggest with sympathy that they may be taking some unrelated issues out on you, possibly other students. 

If it's not usual behavior, say that you're shocked by the accusation, that it has damaged the relationship between you and the teacher, and completely destroyed the trust you have in them. Insist that the paper is entirely yours and that you feel handwriting papers need to return as you no longer trust this teacher's practices or motive, that you would like the teacher to return the points, and rescind the accusation of cheating. 

If you're favored by your teachers Remind the recipients of your email the good things they all have said about you, and that this is an unusual slander to your reputation, and may effect your future such as college applications. Say that you did not want to escalate the situation over an essay, but it's senior year, and these things can make or break an opportunity.

Reiterate that you do not take this lightly and would like a meeting, in person, between the teacher, principal, your parents, and yourself, if the accusation is not rescinded. Insist you should not be punished due to fears that other students use robots  to cheat, because you did not.

4. It will likely help to request a redo with a new topic, and maybe, but not necessarily, that the teacher take it handwritten, and that you're willing to do it while proctored at school.

5. Do not use grammarly again, you may like the idea that it makes you feel more formal, but it usually prevents you from having your own voice in writing, ruining your prose, and it's likely what the teacher's program picked up.


You can also run your paper through these programs yourself and, if you get mixed or contrary results, use it as evidence backing your claim that the program is useless. As well as provide past essays to prove your academic competence.",2023-03-02 05:44:56
"It's not ChatGPT specific, 20 years ago multiple teachers accused me of paying someone to do a homework. In the grand scheme of things depending on the consequences of this accusation it's not worth fighting against (I fought it and still for worst possible notation in the end, then I chose a math-oriented career because it was such bullshit). You'll just have a cool story to tell in 15 years and you know your worth and the work you put into it.",2023-03-02 09:30:21
"Just keep in mind if the previous false positive excuse works, you can use chatGPT to write everything in the future and get away with the same excuse",2023-03-01 23:54:32
"If you’re telling the truth then you should deny the accusation and appeal to the next higher adjudicator for these disputes. Don’t threaten your teacher or argue with them beyond denying the accusation. Just escalate the issue and request arbitration from a third party.

EDIT: if you’re not telling the truth and your teacher is right then you need to be careful because you run the risk of being discovered. In this case if your teacher refuses to accept your claim you probably should continue to attempt to persuade them directly. And if that fails then acquiesce and rewrite the paper. 

In both cases it’s a matter of choosing your battles. If your battlefield is weak because you’re lying, a tactical retreat is probably your best option. If you’re telling the truth then you have a pretty good hill on which to mount a fight and rallying allies to your defense will create persuasive inertia in your favor.",2023-03-02 00:38:02
"While my academic facility has yet to discover ChatGPT’s capabilities as a tool for assistance in writing, I’m somewhat fearful of what could happen if they learned about it and started to crack down, because I also have a very formal writing style similar to ChatGPT, and I’d likely be the first student flagged solely because my work holds itself to higher standards and utilizes a much more professional tone than that of my peers.",2023-03-02 01:14:57
Do you have the edit history for the document (like on google docs)? If you do it could be used to prove you didn't cheat,2023-03-02 01:23:25
"Ask your teacher to show you the GPTZero report and show your teacher your drafts, notes, etc to prove that you wrote your paper yourself.",2023-03-02 02:40:20
Explain to them that chatgptzero is not a school approved till either. It has a false error rate.,2023-03-02 02:59:59
Who the fuck in your school has approved the use of “GPTzero” to accuse students? Simply stonewall.,2023-03-02 04:43:26
"The kid who made GPTZero is downright malicious with all the false advertising and flawed evaluation. The tool is not meant to be authorative and your teacher is negligent by treating feedbacks from the tool as authorative. Escalate and don't cave in.

Also try to document the case and send this to a tech media outlet. Even in the same media reportings GPTZero proudly puts on their front page there are statements like [""GPTZero serves up results based on GPT-2 calculations. GPTZero might not be as good at spotting GPT-3 content...""](https://www.wsj.com/articles/is-it-human-or-ai-new-tools-help-you-spot-the-bots-11673356404?st=amocfnjwrxh67ru&reflink=desktopwebshare_permalink)",2023-03-02 08:45:59
"“He has had accusations about him about being racist, but I’m not sure if that’s the case here.”

I’m really proud of you for this sort of rational and fair way of thinking at such a young age. While you realize that there is a potential for 1 truth, you realize that there could be another truth. Finding it unfair to direct that sort of perspective and attack at someone just incase you are incorrect of your analysis is something to be proud of, considering how common the opposite approach is.

There is a significant amount of aged adults that have not been able to have such integrity in their entire lives. Well done and I hope you grow to do great things.",2023-03-02 15:35:15
Accuse your teacher of cheating for using software to do his work.,2023-03-02 21:14:11
"Ask your teacher to do his damn job—why the fuck is he gpt “checking your paper” —maybe his sorry ass doesn’t know proper grammar either. 

Maybe if he graded your paper himself, this silly debate wouldn’t exist.",2023-03-02 00:58:44
"**Attention! [Serious] Tag Notice**

 : Jokes, puns, and off-topic comments are not permitted in any comment, parent or child.

  : Help us by reporting comments that violate these rules.

 : Posts that are not appropriate for the [Serious] tag will be removed. 

 Thanks for your cooperation and enjoy the discussion!


*I am a bot, and this action was performed automatically. Please [contact the moderators of this subreddit](/message/compose/?to=/r/ChatGPT) if you have any questions or concerns.*",2023-03-01 21:45:08
"Sorry this is a very difficult situation. I'm currently researching AI detectors accuracy. I cannot help you until my paper is published but I'll tell you that in essence my results show that the AI detectors out today should not be trusted for education settings.

I've [tested GPTZero](https://michaelsheinman.medium.com/testing-gptzero-a-trending-chatgpt-detection-tool-3ee14a056543) before showing it can be tricked easily, but it changed a lot since then and the new problem seems be false positives again. I'll try to make some of my current data about why GPTZero should not be trusted public ASAP and let you know.

It seems like the problem is your teacher doesn't understand how to use AI detectors. Some parts being AI written is actually very common in the new version of GPTZero. Perhaps your best defense is to find a few examples where GPTZero gives a false positive and email them to your teacher.",2023-03-02 00:12:11
Ask teacher to write a paper on same topic and then run it through GPt so we can all see what he/she gets. Hope everything works out for you. We’re you the only student that got results back from the Gptzero or were there others?,2023-03-02 00:23:52
"gptzero lol... no wonder.  horrible stuff.  sorry to say there's no way to solve it easily.  escalate.  your teacher is an idiot, those tools are extremely unreliable, with gptzero especially basically being little better than random chance at being correct.",2023-03-02 01:03:17
"How did you write it? Google Docs? Show the progression of the paper. 

Otherwise, I'd stand firm that you wrote it. There are articles out there stating how easily the AI cheat detectors can be fooled, so false positives aren't impossible. 

In the future, I suggest writing in something that keeps track of your work, so you can essentially show your work.",2023-03-02 01:07:16
