text,date
"The OpenAI classifier is also unreliable.

> [Our classifier is not fully reliable. In our evaluations on a “challenge set” of English texts, our classifier correctly identifies 26% of AI-written text (true positives) as “likely AI-written,” while incorrectly labeling human-written text as AI-written 9% of the time (false positives). Our classifier’s reliability typically improves as the length of the input text increases. Compared to our previously released classifier, this new classifier is significantly more reliable on text from more recent AI systems.](https://abovethelaw.com/legal-innovation-center/2023/02/03/openai-wants-to-help-you-figure-out-if-text-was-written-by-openai-but-what-happens-when-its-wrong/#:~:text=Our%20classifier%20is%20not%20fully,the%20time%20(false%20positives).

We can compute the [Positive Predictive Value (PPV) and Negative Predictive Value (NPV)](https://en.wikipedia.org/wiki/Positive_and_negative_predictive_values)based on a variety of assumed prevalences.

| Prevalence | PPV | NPV |
|:--------|-------:|-------:|
| 10%  | 24% | 92% |
| 20%  | 42% | 83% |
| 30%  | 55% | 74% |
| 40%  | 66% | 65% |
| 50%  | 74% | 55% |
| 60%  | 81% | 45% |
| 70%  | 87% | 35% |
| 80%  | 92% | 24% |
| 90%  | 96% | 12% |

So, basically, according to OpenAI's own numbers, if the true proportion of students submitting AI-generated text as their own is 50%, when their tool predicts a work is ""likely AI,"" the tool is correct less than 3/4 times, and when the tool predicts a work is likely human it's basically a coin toss (5/9) whether it is right or not.

Given my own experience grading student work, I'd say the likely true prevalence is probably around 30%, so if the tool says it is likely AI the chances it is correct is basically a coin-toss again (5/9).

GPTzero claims a false positive rate of < 2%, but that number (even if true) is based on testing real and generated news articles. Homework papers typically have a much more rigid structure—most responses I've seen coming out of ChatGPT look like standard five-paragraph essays, so right out of the gate any student papers are going to feel similar to ChatGPT generated text.

So, I would look at anything coming out of GPTzero (or OpenAI's classifier, or any other tool which purports to be able to differentiate between human and AI written text reliably) with a healthy dose of suspicion.

u/feetstreetseat you should fight this vigorously, using statistics, because they are in your favor. If you need a more formal presentation, let me know and I can try to help.",2023-03-02 09:17:11
"Thank you kind human, ill be running all my submissions through this from now on to avoid getting into a similar soup as OP.",2023-03-02 04:38:05
It's still unreliable tbh.,2023-03-02 04:25:51
I just tried this and beat it in 2 minutes AI classifier definitely not reliable as well,2023-03-02 10:03:35
I was able to get around it. I just simply went into the playground and then changed some of the settings and then gave it a prompt and then said to write as if you are a human. And that was able to get around it.,2023-03-02 05:43:04
It says I need to enter a phone number,2023-03-02 12:00:05
Their classifier isn't reliable either,2023-03-02 12:57:15
"Even OpenAIs tool, which I assume is probably going to be among the best as they have the most access to how their own tool writes produces an alarming number of false positives.",2023-04-20 17:07:55
Alright thank you. One of my papers from last semester before ChatGPT is shown to be 80% AI. I’ll also show him that quote haha.,2023-03-01 22:05:12
"And if you want to see the world burn, edit the HTML and show a „response of ChatGPT“. Then have it checked on zeroGPT and show that as another example where zeroGPT fails.",2023-03-01 23:04:29
"Yes, this. Then if the teacher is still feeling one way or the other about it, I would speak with your counselor regarding the situation to discuss potentially switching to another teacher's class so there isn't any lingering stigma or bias against you. Unless it's an AP class that only that teacher is teaching, then you're stuck lol.",2023-03-01 23:37:54
"I faced a pretty much identical accusation when I was at uni. I was literally told by this professor emeritus that she has graded many, many student papers and that she knows how students express themselves verbally, and so she concluded that I must have plagiarised my paper. Having never even copied a sentence off Wikipedia or anything of the sort, I was simultaneously extremely offended - but I guess that degree of praise is genuinely rare, too? Except I couldn't even think about either, because this was a grave accusation with potentially grave consequences.

So I did exactly as you did and I offered to show up during the professor's office hours and write an essay on any topic she may conjure on the spot, just to prove that this is genuinely how I write. I didn't see how else I could have possibly defended myself without potentially causing a bigger conflict than necessary. The professor considered my proposal and told me to show up during her office hours the following week.

Now, this is where the story gets even more peculiar: When I showed up, the professor first chatted with me rather casually, and then she abruptly switched the topic to my paper and said that she's read it again. Then she asked me if I can look her in the eye and tell her honestly that this is my work. And so I looked her in the eye and said that this is my work, and that was it. She gave me a top final grade despite my mediocre exam score and sent me on my way.

Ever since, she would greet me first and stop for a chat whenever I ran into her and she was really going out of her way to be friendly and kind. I still don't know what happened there as she was borderline hostile when she initially made her accusation, but I'm grateful for how she handled it in the end. I suspect that many professors would be too proud/arrogant to ever reconsider their accusation.",2023-03-02 03:50:23
"My university accused me of plagiarism because I cited sources behind a paywall that their library didn't have access to. 

I pulled out my old student ID from a much larger university in my old city and pointed out that just because their tinpot shack of a library doesn't stock a book or journal it doesn't mean that better libraries doesn't. 

The complaint disappeared very quickly",2023-03-02 14:04:59
"I like this, one hour of live writing could prove your style. Remember the point is education. Prove that even grammarly or GPT is also educating you. Prove you didn’t know this and now you do. Prove you researched any sources before using them. Pick a topic you know about so they don’t waste part of that hour reading. For example, write about the school lunch policy here at school from the perspective of a student in poverty.",2023-03-02 17:21:42
"There is no way I would ever even consider doing that to prove I'm inocent, no way. Im gonna escalate instantly. There is no way I'll waste my time to prove something to a brainless person.",2023-03-09 08:21:52
Hmm I wonder if this will be the future of reports you have to prove with edit history. Then there will be programs to create fake revision histories and on and on,2023-03-02 01:41:46
I used word,2023-03-02 00:14:25
You could have hand typed the output from a ChatGPT session for instance. Even broken up your typing with breaks and edits for legitimacy.,2023-03-01 23:53:51
OP shouldn't have to.,2023-03-02 09:19:41
facts,2023-03-02 03:51:15
"I think that’s my only option, might talk to my teacher one more time but if not I will have to contact the school board.",2023-03-01 22:06:04
Thank you. Helpful information to keep in mind when I decide to confront a teacher or higher up.,2023-03-02 00:18:52
Grammarly won't add anything to your essay that wasn't already there. It's not going to correct you on what year Poland was invaded. It's just going to help you be wrong with proper grammar and punctuation.,2023-03-02 07:05:12
"Came here to explain this. If grammerly suggested some paragraph changes, you may as well have put it through gpt. Check school policy on grammerly.",2023-03-02 03:11:27
Grammarly premium. That’s it.,2023-03-02 00:15:28
"I actually made that suggestion in jest, but then asked chatGPT what you should do. Here’s chatGPT’s response:

It can be frustrating and concerning to be accused of academic dishonesty when you have not committed any wrongdoing. Here are some steps you can take to address the situation:

1. Explain your situation: Reach out to your professor and explain that you did not use ChatGPT or any other AI model to write your essay. Be clear and specific in your response, and provide any evidence that you can to support your claim.

2. Ask for an opportunity to defend yourself: Request a meeting or a phone call with your professor to discuss the situation further. This will give you a chance to provide more details about how you completed the assignment and address any concerns that your professor may have.

3. Gather evidence: If you have any notes, drafts, or other materials related to your essay, gather them together to show your professor. This can help demonstrate that you did the work yourself and did not rely on any external sources.

4. Consider involving a mediator: If you and your professor are unable to resolve the issue on your own, consider involving a third party mediator, such as a department chair or academic advisor. They can help facilitate a productive conversation and work to find a resolution that is fair to everyone involved.

Remember to stay calm and professional throughout the process. Accusations of academic dishonesty can be emotionally charged, but it's important to approach the situation with a clear head and a commitment to finding a resolution that is fair and equitable.",2023-03-02 00:22:29
god this is r/ABoringDystopia shit right there.,2023-03-01 23:47:58
Ok thank you,2023-03-02 00:17:18
"What he really needs to learn is that maybe giving assignments that anyone can replicate with a chatbot to the extent not just human but AI tools cannot detect, is bad idea. Maybe put some more thought into giving assignments that's actually useful and think how tools like ChatGPT can be integrated with it. David Deutsch [summed this up quite neatly on twitter recently][1]:

> Anything that can be subverted by the use of AI, should not qualify as education.

[1]: https://twitter.com/DavidDeutschOxf/status/1611342206111043584?s=20",2023-03-02 02:24:09
can you just send this to chatgpt: “Edit my paper so that it passes GPTzero”?,2023-03-02 01:57:28
Sage advice. I hope OP tries this out,2023-03-02 01:21:27
"If you find something the professor wrote before AI became mainstream that turns up as ai-written, keep that to yourself at first and request a meeting with your teacher and their boss. Ask the teacher how confident they are in gptzeros abilities to detect ai-written texts. *Then* run their own text through gptzero and have it turn up as positive in front of them and their boss. Ask again how sure they are the results are correct.",2023-03-02 12:07:53
"There's a great addon for docs called Draftback, which will pay an animation of your entire revision history, so you can see the document creation as a movie",2023-03-02 13:28:43
This.,2023-03-02 03:08:46
"Agreed. I can see how somebody would use a tool like that to get an idea about who might be cheating, but that would need to happen over a period of time, and still would not be a proof, more like a lead.

You can't accuse somebody of using an AI based on a single data point of tool that is known to be wrong.",2023-03-02 09:20:19
Please give more detail!,2023-03-02 03:36:19
" 

Dear \[Teacher's Name\],

I am writing to express my deep concern about the accusation of using AI on my social paper. As I have already explained to you, I did not use any AI tools to write my paper. I have always been a diligent and hardworking student, and I take great pride in my academic achievements. The detection by GPTzero may be a result of my formal writing style, as well as my use of Grammarly Premium, which I have been using throughout my high school career.

I am deeply disappointed that you would accuse me of cheating without any evidence or proof. This accusation has greatly affected my academic record and reputation, and I feel unjustly treated. I hope that you will reconsider your position and review my paper again, taking into account my explanation and the possibility of false positives from the GPTzero tool.

If you still have doubts about my paper, I would appreciate an opportunity to discuss this matter further with you, and perhaps with a third-party mediator, to find a resolution that is fair and just.

Thank you for your attention to this matter.

Sincerely,

\[Your Name\]

Regenerate response",2023-03-01 23:47:13
He’s threatening to call my parents if I don’t confess. I will talk to them but Im not sure how they’d react.,2023-03-02 00:21:23
">We didn't take any action over that one, as invigilation was external, and we figured it was also a(n unpleasant) life lesson

Why the hell live lesson was that? 



That when you face injustices , you shut up and do nothing about it ? 





Some parent you are.",2023-03-02 15:31:55
"Same, i tried putting some pretty terribly written chat messages I did with some clients and it said it was very likely ai generated",2023-03-02 06:19:34
That’s what my friend told me and I already tried lol,2023-03-02 00:19:54
It doesn't prove this is a false positive though.  It just proves the teacher is a hypocrite who also uses ChatGPT.  The difference is it is OK for him to use it.,2023-03-02 01:07:43
This is so cyberpunk dystopian,2023-03-02 06:23:32
"There exist bitter people in the world who are in a position of power over people that they shouldn't be. It might even be that they seek those positions precisely for this power.

The single best thing we can do is never cave to these trolls, fire back on the spot in a calm non-confrontational way, remain in control, do not get defensive. Then if they persist, the next blow should be a metaphorical throat punch. 

The best way to defeat trolls is with laughter. But this is an extremely difficult skill for those not practiced in the arts. The shock of the verbal attack is too much, it triggers a fight or flight response,   anger or paralyzed like a deer in the headlights.

Time runs differently when this happens, you can literally take 3x longer than you expect for a response. Take your time, you can also completely ignore it while you think of a comeback.

Your grandpa could have destroyed this petty teacher in so many ways. As he truly did have a power that the teacher so badly wanted to possess. 

""Rip it up, I can draw more""

""I'll leave the next one unsigned so you can pass it off as your own""

""The real art was exposing your self hate""

Draw a recreation of the event.

----

As for your encounter.

""Shit I should have, ended up wasting 45 hours""

""Please hold your criticisms for the end""

""Thanks for the complement!""

""Should I add some mistakes to make it look less polished?""

Great! I was going for that, ""I cheated look""

""I can model some peanut butter for your jelly later ...""

""No, but I'll be uploading it to <3d sharing site> so everyone else can, sharing is caring""

It is easy to make comebacks after the fact and without the pressure, but it takes practice. Ignore the cringy channel name, but these teaser videos on how to [protect yourself psychologically](https://www.youtube.com/watch?v=BSXoI9MDvU0) from verbal attack are pretty good.",2023-03-02 13:45:06
Not many high school teachers have paper or articles their students have access to,2023-03-01 23:46:54
"Bro hi, search in telegram for goup  🔎  ""chatgpt bypassall""   that group can generate all versions of Chat GPT and pass as if it were written by human.",2023-03-02 08:00:11
"Why should the OP have to go through a tougher ""trial by fire"" because the teacher used a shitty tool (that is not proof) to say that the work was done by an LMM?",2023-03-02 12:39:55
🎯,2023-03-02 03:55:42
"Next time I’ll definitely take preventative measures to ensure AI won’t be detected. At the time of writing the paper, I didn’t think it was gonna be something I would have to be concerned about.",2023-03-01 22:27:15
I’ve tested that and gptzero still says that it is ai written with 78% certainty so it definitely does not entirely conceal it.,2023-03-02 02:21:20
"The OP (/u/feetstreetseat) should actually write an essay on this entire mess, reference the [comment](https://old.reddit.com/r/ChatGPT/comments/11fj3tx/accused_of_using_ai_on_my_high_school_social_paper/jakanol/) by /u/printer_winter and use that as the escalation document to the school counselor. 

Students will now need ""dash cams"" to ensure they have sufficient evidence incase they are accused of cheating. 

OP, pivot this whole ordeal into a win, you have been given a gift.",2023-03-02 12:48:46
"> full Goblin Mode

this is just normal mode",2023-03-02 23:25:01
"I too have encountered teachers who were dead inside. She might have been a gifted writer in her youth and dreamed of a different life.  Probably without overt malice, they attack things that remind them of themself at that age. Or they know you are going to be successful in ways they want, but can never have. 

Also, always remember, they aren't attacking *you* but the idea of you through the lens of their own self imposed failure.

I have also encountered teachers who recognize the spark and do their damnedest to fan it into a flame.  We should all try and be the fan.",2023-03-02 13:51:42
"#tl;dr

The writer is seeking advice on what to do when their teacher accuses them of cheating, despite their claims of innocence. The advice given includes involving parents, sending a professional email to the teacher, cc'ing the principal and academic counselor, requesting a redo with a new topic and possibly handwriting it, and not using Grammarly again. The writer is also advised to provide evidence of their academic competence and run their paper through other programs to prove the teacher's program is ineffective.

*I am a smart robot and this summary was automatic. This tl;dr is 83.3% shorter than the post I'm replying to.*",2023-03-02 14:50:16
"I’m trying not to go down the path of relying on AI for now. No shame if you do, but it’s a risky road that I’m trying to avoid.",2023-03-02 00:21:58
"#tl;dr

The article discusses criticism of the GPTZero tool, created by a teenager, for its false advertising and flawed evaluation. The tool is not meant to be authoritative, but some teachers may treat feedbacks from the tool as such, leading to negligence. The article suggests escalating the issue and documenting the case, and possibly sending it to a tech media outlet.

*I am a smart robot and this summary was automatic. This tl;dr is 95.69% shorter than the post and link I'm replying to.*",2023-03-02 14:50:22
"Run text your teacher will agree wasn't written by GPT and find some that gives a false positive. Academic papers written more than a year ago, etc. Everybody who knows AI knows detectors don't work. AI literacy in the general population is low (I see a claim that 84% are illiterate), I wouldn't be surprised if it's even lower with teachers.

If it's any consolation, 35-40ish years ago my English teacher wouldn't let me submit work printed with a dot matrix printer because he said computers write the reports for you. Couldn't be convinced otherwise. Fucking idiot. I still hate that guy.",2023-03-02 01:30:04
"There was one other I know of, but they actually used the AI, so not sure.",2023-03-02 00:25:53
and it will keep going down,2023-03-02 02:46:32
this \^,2023-03-02 03:54:32
"Is using a grammar checker against school policy? If not, the school’s messed up.",2023-03-02 04:44:16
"That would be the strongest defense you could mount. /u/feetstreetseat, it's important that you see this. Just the fact that you'd be willing to have that happen would send a strong message.",2023-03-02 14:19:11
"Gptzero detects that, but to be fair it detects everything. It even detects my own writing. All it does is look for mistakes and randomness, if it doesn't find any it says it's AI written.",2023-03-02 16:38:57
"Absolutely this. I make my students do everything in Google docs so I can see version history. It let's me know who suddenly had 1500 words appear in their document without any errors, or edits.",2023-03-03 06:09:41
This is maliciously horrible advice.,2023-03-02 12:53:10
"I’m in Canada, and grade 12 is last year of high school. It’s one of the 6 papers that go toward my final mark, and it’s important I do well on it. I’m not sure about a grading board but i’ll for sure look into it. Thank you!",2023-03-01 22:03:48
"Imo that's a pretty bad idea. Language can differ depending on circumstances. Someone can write in one way when they have time as well as resources for research, and in another when they are put under pressure and are given a short time-frame. 

A better option would be to have the student talk freely about what they wrote, by having them explain it in their own words. Someone who wrote on their own will know the basics of what they wrote, as opposed to someone who used AI to generate the essay",2023-03-02 01:20:40
"Also in the future, draft ALOT on paper to avoid the accusations again. If you’re innocent, make it easy in the future to prove that",2023-03-02 00:53:21
"#tl;dr

GPTZero is a free detection tool created by a Princeton senior, Edward Tian, that is designed to help educators detect writing generated by ChatGPT. It detects AI-generated text by measuring two properties of text called “perplexity” and “burstiness"". The pilot version of GPTZero is available to all educators on the GPTZero website and has a false-positive rate of less than 2 percent.

*I am a smart robot and this summary was automatic. This tl;dr is 95.41% shorter than the post and link I'm replying to.*",2023-03-02 14:50:47
I’m real.. I think,2023-03-02 07:04:24
"Not just “unreliable”, but just like scanners for “plagiarism” they are inevitably rigged for false positives because they get 0.0001% of dev effort as the tool they are trying to detect.",2023-03-02 12:33:50
"It did.

Grammarly uses AI for its work, and Grammarly premium can actually do rewrites of entire paragraphs (and more). You can write an entire paper with Premium.",2023-03-02 06:05:38
"Nice ChatGPT reply, took me a sec to realize it",2023-03-02 11:44:38
"Please. Since when do teachers not panic whenever something new happens? Back in my day they worried about calculator watches.

OP’s story is entirely plausible and GPTZero is highly fallible - as is ChatGPT.",2023-03-02 11:05:19
"> but the fact that you are on r/chatgpt and probably nerding out like the rest of us on it, you used it

That's not a very convincing line of reasoning.",2023-03-02 09:24:37
Maybe. I’ve tested it on all my papers and only 1/6 paragraphs are detected as AI. I just got unlucky this time where it said 2 of my paragraphs werr,2023-03-02 00:18:07
You DO NOT want to see my math grade,2023-03-02 00:20:29
"Wow, what a dick comment, unnecassary.",2023-03-02 13:22:53
yikes,2023-03-02 15:35:37
Your post has violated the rules of r/ChatGPT.,2023-03-02 18:42:35
"Nope. Innocent until proven guilty only applies for criminal proceedings. This is a common error people make.

The decision threshold for education (or any administrative decision for that matter) is preponderance of the evidence, or whether it’s more likely than not that something occurred (very few schools use a different standard).

Also, don’t make false accusations, that’s likely the worst advice possible and will result in worse outcomes.",2023-03-01 23:09:31
That's not how school works,2023-03-01 23:20:10
"Who cares.  Teachers using “detection” algorithms inevitably need to deal with false positives.  

It’s like a lie detector, or drug dogs - just BS to get the result you are looking for",2023-03-02 12:32:03
"No, composition is not simply a matter of citing sources, and allowing robots to do your work.

Doing it yourself, and how you do it is like 70% of the grade, it's the most important part, and the main skill they're trying to teach.",2023-03-02 21:59:47
"Kinda dangy...

Also, search history is easily doctored, chrome lets you delete entries one by one.",2023-03-01 23:43:32
"That’s a totally unfair assumption to make. Just because you know one person who acted poorly doesn’t give you the right to make unfounded accusations against other people. OP is already going through a really shitty situation, and here you are trying to make him feel worse for no good reason. Please think before you type next time.",2023-03-02 00:43:44
"I’m coming to the ChatGPT subreddit, because it’s what my teacher accused me of using. No other subreddit would have as much knowledge of ChatGPT then this one. What would I gain from lying to strangers about my innocence?",2023-03-02 00:28:15
I’ve used grammarly all my high school years. Never been told it was or wasn’t allowed.,2023-03-02 00:23:38
COME AROUND,2023-03-02 01:49:24
"No bullshit, that’s the way to handle it.  

Make it more inconvenient for them to enforce their baseless allegation than it is to just say “ok ok you win.”  

Teachers at your level don’t give a shit.  They’re busy and underpaid. Don’t ever say that to them though. Super insulting.",2023-03-02 03:19:13
AI can't fake magazine serial killer cut out lettering yet!,2023-03-02 03:55:18
