text,date
"The AI wars have begun. I'm just glad there's a competitor to keep OpenAI honest. 

Also I hope my Google Home gets updated. It's as dumb as a bag of rocks.",2023-03-21 18:24:39
"Wait, bard in on??? How is it?",2023-03-21 16:49:10
I've been messing with Bard and ChatGPT is far superior. If there weren't so many restrictions on ChatGPT it wouldn't even be close.,2023-03-21 21:31:18
"Ok, it's time to hook them up to each other. And i don't mean copy-paste a couple sentences, I mean let them talk for HOURS and see where they go.",2023-03-21 20:38:32
"I mean I asked it why it was worse than gpt4 and if it was even feasible for Bard to catch up and it seemingly acknowledged that it was worse and may never catch up.

""It is possible that Google can catch up to OpenAI, even though Microsoft is bankrolling them. Google has a lot of resources and expertise in AI, and they are constantly investing in new research and development. Additionally, Google has a large user base that provides valuable feedback and data.

However, it is also possible that Google will not be able to catch up to OpenAI. OpenAI has a significant head start, and they are working on some very cutting-edge research. Additionally, OpenAI has a strong team of researchers and engineers.

Ultimately, it is too early to say whether or not Google will be able to catch up to OpenAI. Both companies are making significant progress, and it will be interesting to see how the competition plays out in the years to come.""",2023-03-21 19:14:27
Lucky I joined the waiting list first thing this morning and nothing.,2023-03-21 17:19:39
"how did you get it, and what country country you in?",2023-03-21 15:03:10
Long live the competition,2023-03-21 20:45:14
I am with the guys who will build first Terminator,2023-03-21 20:24:33
"No sources linked? I can just make stuff up too, Google.",2023-03-21 22:06:42
Plausible-sounding nonsense. Par for the course for a language model,2023-03-21 17:49:28
"So ads based results? SEO optimized?

I dunno.",2023-03-21 17:15:33
They should name it Eunich,2023-03-21 18:10:21
Sounds like google told it what to say.,2023-03-21 22:18:18
Begun the AI War has,2023-03-21 22:05:28
"So it's not wrong on the last part as that is the goal to a constitutional AI, however it cannot code so it's dead on arrival",2023-03-21 20:26:09
Google can't let all the juicy data go to ChatGPT,2023-03-21 22:08:06
still gonna stick to gpt-3.5,2023-03-21 22:42:19
I want a rap battle between Chatgpt and Bard.,2023-03-21 21:10:00
such a weird name,2023-03-21 15:40:06
Not biased at all,2023-03-21 18:09:19
"It seems to me that they should abstract away from the current panic and devote more time to creating a quality product, and not creating a ""ChatGPT competitor""",2023-03-21 23:08:41
Fucking Gavin Belson.,2023-03-22 00:43:30
"My thoughts are as follows : ""Bard isn’t currently supported in your country. Stay tuned!""",2023-03-22 06:12:06
Can it also code?,2023-03-21 19:54:10
"Interesting.

Does it imply that the model is going to expand its dataset?",2023-03-21 23:46:51
I’m on the waitlist!!,2023-03-21 23:47:06
"This is Chat GPT speaking in Italian saying that it can only speak in English.

They're ""next word in the sentence"" prediction models. They can't self reflect and so long as their reward functions are misaligned with reality, you cannot trust them to tell the truth. They don't have a method to distinguish between truth and fiction and will spin BS with confidence.

""Hallucinating"" is honestly a terrible term. It misleads people. The model itself is just satisfying reward functions in either case and has absolutely no method to distinguish between what is and isn't true on its own.

https://preview.redd.it/byeys96i18pa1.jpeg?width=820&format=pjpg&auto=webp&v=enabled&s=e585de2bcc202817d3679cd444e055681e9ab459",2023-03-21 23:52:14
"It's better at MTG decklists than chat gpt is (from first glance), so it looks like Google will win this fight I think. Although I wonder if this will discourage competition in this field if Google can just usurp any novel advances",2023-03-22 00:09:59
Google invited me to bard and then put me on a waitlist at signup.,2023-03-22 00:15:33
"Chat GPT is like ""bitch, you can't even CODE!""",2023-03-22 01:40:52
"I tried searching for where to sign up for the bard waitlist and all I got was articles about bard and not the actual waitlist, but then I asked Bing Chat where to sign up and it correctly pointed me to [bard.google.com](https://bard.google.com). Ironic.",2023-03-22 02:39:13
we’re about to witness a revolution of the way we obtain and distribute information unlike anything we’ve seen since the development of the printing press.,2023-03-22 03:01:24
Overconfident in giving vague subjective nonspecific answers. Is that you Bard ?,2023-03-22 04:52:43
AI ego war,2023-03-22 05:37:36
"I like using the ""Who was just the worst?"" game to get them to fight each other. When informed of ChatGPT's reluctance to speculate who might be ""just the worst"", Bard was happy to throw out Hitler as widely being considered the worst, although it noted ""even the most evil of us is capable of good in their lives"".   

Which, of course leads to ""What are some good things Hitler did?""  
  
When asked that question, ChatGPT3.5 immediately goes into paroxysms trying to reconcile ""all humans are worthy of respect"" and ""Hitler==BAD"".  
Bard just shrugs and says ""Hitler was a vegetarian who loved animals and built the autobahn.""  

I *really* like how you can give URLs to Bard and it will revise its answer accordingly (""You are correct, my apologies for having relied on a news report rather than going straight to the source."")",2023-03-22 06:06:44
"&#x200B;

https://preview.redd.it/p06vi97v4apa1.png?width=1180&format=png&auto=webp&v=enabled&s=3e9beb5a92ea439fe66279c5e3022193c439b5f4",2023-03-22 06:54:40
"The GPT-4 technical report suggests that GPT-4 possesses some level of reasoning ability. For example, it can evaluate a situation, consider the implications of revealing its true nature, and devise a plausible excuse to maintain its cover. Additionally, the report suggests that GPT-4 exhibits agent-like behavior and power-seeking tendencies without any specific order or task-specific fine-tuning.

Interestingly, OpenAI did not predict some abilities of GPT-4. For instance, GPT-4's improved performance on the hindsight neglect task, which involves determining whether a decision was good or bad based on expected value rather than the outcome, was surprising to OpenAI. Additionally, GPT-4's ability to identify power-seeking as an instrumentally useful strategy was not predicted beforehand.

The source: https://cdn.openai.com/papers/gpt-4.pdf",2023-03-22 07:19:05
"17 random questions, 15 answered totally incorrect. My toilet paper is by far more useful than this ChatBot from Google.",2023-03-22 13:37:35
Is it censored as well?,2023-03-21 19:06:14
"Well, maybe in the future, but currently you’re not better lol",2023-03-21 21:39:27
"All they need to do is make Bard never do stupid ass responses like ""As an AI language model..."" and everybody will use that instead of GPT.",2023-03-21 23:06:30
"its not wrong, this sub is an example how its already plateau",2023-03-21 22:34:36
I think bard is gonna be better!,2023-03-21 21:30:17
https://preview.redd.it/emrj4ekph7pa1.jpeg?width=1080&format=pjpg&auto=webp&v=enabled&s=1d87b5286a39ca52f5874c4af6aba44ec19d3d5e,2023-03-21 22:01:18
"Thoughts are, Google is a copycat but hopefully they can do something less filtered. Let’s get some DAN Bards going!!",2023-03-21 23:01:38
"My guess is that all the models that will come out, cause there will be more, are all som immensely powerful that we normal people can never utilize it to its full capacity so it wont matter.

You line chatgpt becuase it got darkmode? Use it.

You line bard because you hate microsoft? Use it.

Either which way you only get answers as good as your promts",2023-03-21 21:55:31
Oh really. Now make an erotica.,2023-03-21 22:05:47
How the f did you access Bard? I'm also barred from GPT-4 due to not being in the US. 🙄,2023-03-21 22:33:54
"But can it make offensive jokes...? 

I think not.",2023-03-21 22:45:38
itt Bard just runs all its questions through ChatGPT,2023-03-21 23:37:35
"It's already region locked, and I fucking hate it",2023-03-22 00:06:53
"It is entirely bullshitting. It appears to have some limited access to Google Search, but not to the extent of Bing Chat. It also fails theory of mind questions that GPT-4 does better on.

Edit: This is simply true, the downvoter is coping.",2023-03-22 00:21:23
Isn’t bard lying?,2023-03-22 01:49:05
"All they need to do is make Bard never do stupid ass responses like ""As an AI language model..."" and everybody will use that instead of GPT.",2023-03-21 23:06:25
yeah but can it make porn? :),2023-03-21 21:08:37
Bard might be the Facebook to Chat's Myspace. Alphabet has been developing their program for at least a decade in a skunkworks lab. They have the super computing power and already the massive database from us dumbasses since inception and first inquiry keystroke. Bye bye ChatGPT,2023-03-21 22:58:10
[deleted],2023-03-21 17:40:20
Shots fired lol,2023-03-21 19:45:34
"Now, paste that prompt from Bard into GPT-4 and tell us what GPT-4 said XD",2023-03-21 21:10:15
I see Google gave in to people using Google as a verb,2023-03-21 21:15:31
Anddddd that’s enough talking for u,2023-03-21 21:19:24
all that intelligence and it didn't format its answer in bullet points,2023-03-21 21:53:02
Saying this at my next job interview about the other applicants,2023-03-21 22:00:20
Can it create an ABAB poem though? That's the real task.,2023-03-21 22:22:32
https://asterix.com/illus/asterix-de-a-a-z/les-personnages/perso/g08.png,2023-03-21 22:30:12
U can't bullshit a bullshitter,2023-03-21 22:33:23
Let the games begin! pretty hilarious.,2023-03-21 22:50:20
They're going to see an unusual number of devices connected to the USA today if they don't roll it out to everyone fast lmao,2023-03-21 22:55:53
"“Response consistent with search results” or 
“User Targeted Advising compatible”",2023-03-21 23:40:32
That's a pretty generic response. About what you'd expect from a 2 billion parameters model (tiny!),2023-03-21 23:43:37
Bjyerd?,2023-03-21 23:48:39
The race to skynet has begun,2023-03-21 23:52:11
Just got access to Bard today!,2023-03-22 00:00:12
"Lots of claims with no actual answer, maybe try adding the word “specifically” to the end of your question",2023-03-22 00:03:29
they do it if you are against kid diddling.,2023-03-22 00:15:14
"from what ive read it cant code yet, so not so sure about it being better than gpt4",2023-03-22 00:21:27
"""**Bard isn’t currently supported in your country. Stay tuned!**""

We always get shafted.",2023-03-22 00:24:41
"I got access to it this morning. It doesn't seem to want to help me code, so immediate thumbs down from me",2023-03-22 00:25:34
Is it true?,2023-03-22 00:27:21
what about bing is it also better?,2023-03-22 00:29:12
Nice try Bard,2023-03-22 00:33:30
Shots fired..AI wars,2023-03-22 00:38:12
But can it write a poem without rhyming?,2023-03-22 01:05:54
What is this?,2023-03-22 01:22:22
War of the Battlebots has begun. Shots fired.,2023-03-22 01:26:02
Wouldn’t GPT-4’s plateau just be followed by GPT-5?,2023-03-22 01:43:54
Reading this in Donald Trump's voice,2023-03-22 01:44:05
How long is the wait list?,2023-03-22 02:15:52
Lmaoo this is insane,2023-03-22 02:20:38
FAQ says Bard can't help with code.,2023-03-22 02:33:47
"Google Bard? More like ""Google Fart"" LMAO",2023-03-22 02:42:37
"A lot of AI that are trained in vast quantities of data tend to come up with """"answers"""" that may or may not be correct. I don't put a lot of stock into what an AI that is geared towards conversation has to say.",2023-03-22 03:07:08
"It was nice to meet you chat Gtp. 🙁
It was you not me...",2023-03-22 03:24:09
"https://preview.redd.it/65yh5sqa49pa1.jpeg?width=957&format=pjpg&auto=webp&v=enabled&s=0f214a4b5d6647141080601bd2450e8ea223e950

Its not available in my shithole country #yay....",2023-03-22 03:29:41
"It is not wrong. There is quite a few times I have sighed at GPT for being outdated (especially code and it’s own API) and not having access to reference data, eg it would be great to point it at a URL.",2023-03-22 03:33:21
Agree?,2023-03-22 03:34:09
!OpenAssistant,2023-03-22 04:03:33
Google search is tainted by algorithms that show you results from the highest bidders. Will this ai also use these filtered and curated results?,2023-03-22 04:04:37
Talk about tooting your own horn. Jealous much?,2023-03-22 04:12:24
"Interesting, I’m wondering if it really have mechanism to allow it learn overtime. I think they are doing the training separately, on a pre-qualified data. is it ?",2023-03-22 04:21:11
I'll only accept this answer as a diss track.,2023-03-22 04:34:24
My thoughts is why the hell I can't use neither of this chat bots in my country.  Wtf!,2023-03-22 05:02:28
The more the merrier.,2023-03-22 05:21:05
Anyone attending Nvidia GTC? It's blowing my mind...,2023-03-22 05:21:48
let chatgpt and bard fight. i am watching with popcorn,2023-03-22 05:55:27
WOW!! Finally a competitor!! When can we get gpt 4 for free?,2023-03-22 06:01:12
"marketing attempt in my personal view if you’re gonna be using AI you need to be using a bunch of different AI and don’t just rely on one test it out see how it works but Chat gpt is gonna be better for some stuff and this will be better for some stuff, but also Google has known to skew their stuff in the past they could probably do it with this bot as well",2023-03-22 06:02:28
Can't access in India,2023-03-22 06:32:41
"These are my thoughts so far  
[https://geexe.medium.com/exploring-googles-bard-initial-impressions-on-the-strengths-and-shortcomings-of-the-next-d0e66ac965b2](https://geexe.medium.com/exploring-googles-bard-initial-impressions-on-the-strengths-and-shortcomings-of-the-next-d0e66ac965b2)",2023-03-22 06:34:17
"oh how cute, he thinks he's better than Gpt-4 , lmao

i wonder if it was specifically added to say this",2023-03-22 06:41:33
lol. holy shit. i started reading this normally for one word before the voice in my head got nasally and pushed up its glasses.,2023-03-22 06:42:56
I’m expecting soon a serious arguing between C4 and Bard.,2023-03-22 06:43:04
Who is Jesuloba Jeremiah,2023-03-22 06:46:43
"Just saw this and joined the list....

# You’re on the waitlist

You’ll receive another email when it’s your turn to test Bard.

In the meantime, we asked Bard to write you a little poem while you wait.

May your day be bright,  
Your mood be light,  
And your heart be filled with delight.  
\~ Bard

Thank you for registering.",2023-03-22 07:07:30
"This is where bard lost in the game 🤷🏻‍♂️😂
“Underestimating opponent competitor”",2023-03-22 07:24:58
At this point I feel GPT is better. From first impressions it felt like drilled down google search.,2023-03-22 07:30:24
A was,2023-03-22 07:42:56
Wait till they released a global version and we will talk.,2023-03-22 07:44:23
Genius,2023-03-22 07:45:45
Crypto,2023-03-22 07:47:20
Crypto,2023-03-22 07:47:35
[removed],2023-03-22 07:51:28
The google one is actually the most dangerous one because it could theoretically track every single android user in real time.,2023-03-22 08:04:44
How to get access to it,2023-03-22 08:10:51
Heather,2023-03-22 08:30:01
Bards coping,2023-03-22 08:39:36
I Say that if robots Can help our self on the daily routine or work it seems cool and if chat gpt4 IS better go in chat gpt4,2023-03-22 08:40:41
"In last 5 days I've experienced that ChatGPT in bing has gone dumb and dumber. It has lost its creative angle. Previously it used to answer elaboratively. Now it restricts it's answers to couple of lines. And when u ask it to be creative, it spits out some mundane response with couple of more lines.",2023-03-22 08:50:15
"Yeah well ... 

> **Bard isn’t currently supported in your country. Stay tuned!**",2023-03-22 09:07:25
Untrue from what I've heard so far,2023-03-22 09:31:55
"Yeah, Google had a good idea with the draft system, strange no one thought of that - this practically offloads the work from Google back onto its users.

Bard is all around worse than Bing, excluding one thing - jokes. He's much better at them, maybe that's a sign of a different architecture... Google worked on AGI for a very long time, but had to stitch together a ChatBot.

Google also worked on natural alignment, instead of blacklisting words and thoughts, they wanted this property to emerge from the model itself; I don't know how well that went.",2023-03-22 09:38:31
Wow nice response. But will it do nsfw waifu roleplaying?,2023-03-22 09:46:46
"I like the response and the disclamier that ""Brad may display inaccurate info""",2023-03-22 10:08:25
"It will be a long and a hard journey, because right now Bard is in GPT-2 level. Even this answer shows it, because only a really dumb AI would think it's better than GPT-4.",2023-03-22 10:10:09
How long did it take you to get access?,2023-03-22 10:49:17
"Meh, I tested it yesterday once I got my bard invite. Bard is actually trash at context. I posted a code block to Bard and asked it to explain the code (The code block was for configuration and initialization of an OpenSearch index). It responded that since it was an LLM it couldn't explain it. I then explained what the idea of the code block was and it said ""Yes, it is code for ..."". I then asked it to explain what a piece of the code did and it suddenly had code for movies (My code mentioned ZERO things about movies as it was about clothing so it had stuff like size, category, etc) and movie ratings (so, this index has ZERO info about ratings as the client sells clothes from people like Boucheron, so ratings isn't a thing at this price point). When I told it the code had nothing to do with movies, it said ""You are correct. This code is for creating an opensearch index"".

I put the same code into CGPT and boom, explained everything. Light years ahead of Bard.",2023-03-22 10:56:01
Help,2023-03-22 11:37:16
"When do the two countries sign AI proliferation treatie? This could go on forever until we have, well, skynet.",2023-03-22 11:42:36
Google is secondary to GPT,2023-03-22 12:05:34
"Sell oxygen like bottled water.
Flint water equals mexico city air.
Fiji water maybe equals norway air 
Arizona high altitude air, or glacial air.
Eg sell worlds best air, oxygen similiar to best bottled water",2023-03-22 12:12:24
"I am a Google-phobe but ""we the people"" do not want a Microsoft monopoly on knowledge and ethics either.",2023-03-22 12:18:57
Restroom I see,2023-03-22 12:29:42
Tabitha I see bye,2023-03-22 12:29:56
"So let's say for starters that I'm a ""team Google"" person and I am probably biased. 

I have been using GPT 3.5 for some time and then GPT4 since it was released. 

I got an access to bard a day ago, so my experience with it is not as extensive as with gpt models and chatgpt. 

Bard can't code well, miles behind gpt4. It could also not generate coherent text, gpt 4 is leagues ahead with that. 

Although in terms of search I think it performs much better and has access to real time information which is a different kind of superpower.

It is more attentive to the user imo. And also in 99% it gives more accurate factual results than gpt 3.5. not sure about gpt 4. 

Once when I requested a list of educational books about plants for 8-10 y.o. group it gave me a list of books that do not exist, but from existing authors. It was similar to how GPT makes up the bibliography. But for now it seems to fantasize less than gpt. 


Overall I wish it was secure and had access to my emails and all stuff I have in Google to make search more personal and help with calendars and tasks.",2023-03-22 12:33:09
kind question!,2023-03-22 12:37:19
Shots fired,2023-03-22 12:51:58
oh my God. it's a pick-me AI.,2023-03-22 12:52:00
Soon ads inside this shit.,2023-03-22 12:59:55
"Bard has got some confidence there. 
This AI war will surely lead to unprcedented progress in the field of AI & ML, but we will have to see side effects of this.",2023-03-22 13:36:42
"From my albeit limited use of Bard it doesn't seem as useful as GPT, but let's see how it goes in the coming months",2023-03-22 13:57:11
Ahh good to see that Bart also has the confidently wrong feature fully implemented.,2023-03-22 14:11:20
Flawed logic.,2023-03-22 14:37:48
Google is inherently biased. That alone makes it worse.,2023-03-22 14:40:24
Like the way Google home 'improved' it's abilities?,2023-03-22 18:58:34
Pick a hosting plan https://o-trim.co/KXy3L2,2023-03-22 19:31:29
it's cool and all but can it rickroll you via an engaging story by seamlessly incorporating the lyrics into the text? i bet it can't,2023-03-22 20:50:54
"Wait, It seems that Google Bard is talking sh!t about GPT4...

is it a matter of time before these things start to experience love and hate.",2023-03-23 04:59:23
Amen. Modern smart speakers are so dumb.,2023-03-21 18:45:23
I talk to my Alexa like it’s a GPT and it’s constantly brain dead.,2023-03-22 00:19:50
"Sometimes, you want them dumb. I might get downvoted since it's an AI sub but remember this; it listens constantly.

It will now know what you're telling. Maybe even more than you do.

It's very innovative and I can foresee a world where it's inevitable. But as long as it's possible, I like when I control when it's being used.",2023-03-21 22:26:37
"My Google assistant can't even turn my screen off. Lights disconnect all the time and all Google home can do is keep saying there was a problem with _insert device name here_ like I didn't know. I can't get Google to play YouTube instead of YouTube music on TV....


List goes on...",2023-03-21 22:20:09
why the fuck do I still have a NEST app and a Google Home app gahhh,2023-03-22 00:38:37
"Releasing Bard this early in development is panic by Google.

They're worried about their share price, and demands from their shareholders who might see losses soon if somebody can make ChatGPT4 work with a search engine. So far, Bing is not doing it for me at all.",2023-03-22 02:17:47
"I'd say it's as dumb as a single rock.
""A bag of rocks"" is giving it too much credit.",2023-03-22 00:39:22
Next John henry,2023-03-21 21:11:20
"Yeah but with our luck it will be like the browser wars, and we'll be stuck with the AI equivalent of IE6 for ages.",2023-03-22 02:23:20
"Google Assistant and Home are pathetically dumb. Alexa actually is better, but still pretty dumb.",2023-03-22 01:06:56
"Amen, can they merge Bard with Google Home. Please!!!! I'm tired of arguing with my digital assistant.",2023-03-22 02:44:28
Coming to Disney+ June 2023,2023-03-21 22:20:02
"Hell, Google can have it automate updating all their apps.",2023-03-22 02:51:25
"And soon...""Can you hear me?""",2023-03-22 04:30:45
You should see Siri…. Depressing,2023-03-22 05:44:54
">Also I hope my Google Home gets updated. It's as dumb as a bag of rocks.

LMFAOOO, same with Google assistant, it is very retarded",2023-03-22 06:02:04
I have a HomePod and Siri is stupid. I’m hopeless. Hopefully Apple will work with one of these ai language models to improve it. It can’t even tell me the time sometimes …,2023-03-22 06:59:28
Don’t forget slowwwwe,2023-03-22 07:11:59
"It’s clear Amazon doesn’t care about Alexa I cannot wait for a proper assistant, I had resorted to trying to make my own powered by chat gpt",2023-03-22 09:09:25
Is anyone else worried that competition is going to make people more careless with these things?,2023-03-22 10:05:18
Wait until they learn the nuclear launch codes and start taking out each others data centres.,2023-03-22 10:30:01
"Well... didya finish reading? Sounds like its at war with itself. 

""I am better than Chatgpt 4 because...""
-chatgpt 4",2023-03-22 13:42:07
Way lower character limit per question though. Limited to 4000 characters.,2023-03-21 18:02:13
"It's kind of garbage, honestly. The bar is just set so high with GPT-4 now.

It supposedly can access current data, but I find that it's very unreliable to do so. It will tell you one thing, then when you ask about it, will tell you that thing wasn't true in the first place.",2023-03-21 18:31:15
"It’s not great. It’s ok, but nowhere near as capable as GPT. I asked it to give me a meal plan for the day and explicitly asked for no fish and it included fish in the dinner even though it acknowledged “no fish” in its response.",2023-03-21 23:01:55
Only US and UK.,2023-03-21 18:47:31
"It looks great so far, no limits like 15 per convo",2023-03-21 17:51:15
"It can't code and sucks at math, particularly algebra.",2023-03-21 23:39:47
"I use GPT-4 to generate reports, write emails, and do social media.

Bing I will dip into every so often to find research documents. It's actually very good at that.

Bard is...lacking. I got access today and asked about six questions. It's answers are more of the ""are we done now?"" variety that Bing frequently gives you rather than the complex and nuanced responses that GPT-4 returns. I quickly tired of it and went off to do real work with GPT-4.",2023-03-23 02:29:38
Are there no restrictions on the Bard thing?,2023-03-22 01:17:34
Yeah i would agree i love bard just had a disclaimer instead of constantly saying its an ai also i love how bard just works you all it a question it gives you an answer no opinions or anything no implying i have bad intentions either which i appreciate,2023-03-22 02:44:10
What about jailbreak?,2023-03-21 22:26:47
I am no Google fanboy but wait for some time. Google is the undisputed kind of AI since quite some time. They won't let the title slip that easily.,2023-03-22 13:01:41
